{
  "schema_version": "1.0",
  "source": {
    "type": "autocad",
    "name": "minimal sprinkler node",
    "units": "mm",
    "exporter": "LES.AutoCAD.JsonExport"
  },
  "elements": [
    {
      "id": "dwg:line:01",
      "handle": "A1",
      "type": "LINE",
      "layer": "FP-PIPE",
      "name": "pipe segment",
      "geometry": {
        "kind": "line",
        "start": [0, 0, 0],
        "end": [1200, 0, 0]
      },
      "properties": {
        "diameter_mm": 25,
        "system": "sprinkler"
      }
    },
    {
      "id": "dwg:text:01",
      "handle": "A2",
      "type": "TEXT",
      "layer": "Annotation",
      "name": "node label",
      "geometry": {
        "kind": "text",
        "position": [420, 120, 0]
      },
      "properties": {
        "text": "Sprinkler down"
      }
    }
  ],
  "relations": [
    {
      "from": "dwg:text:01",
      "to": "dwg:line:01",
      "type": "annotates"
    }
  ]
}
